{
  "action": "rollback_edition",
  "actor_id": "rollback-operator",
  "after_digest": "sha256:f71d899f34ef833ce5131bc3d6b00dfa81c6babf8ba6c4c4d63de333720b1aa1",
  "after_revision": 4,
  "at_utc": "2026-08-11T10:20:00Z",
  "before_digest": "sha256:3786c903ef3c3cfd71e6f26b70c97bbde4d92d2cb431fdade85b6416749a36de",
  "before_revision": 3,
  "candidate_id": "p2-s0a-440c91a56e984957",
  "error_code": null,
  "evidence_refs": [],
  "impact": {
    "mixed_snapshot": false,
    "new_registry_revision": 4,
    "snapshot_mode": "whole_edition",
    "target_snapshot_id": "registry-snapshot-sha256:d1111847888e4ec343de974e943cdea467207c63c5091814dcab79512d365fff"
  },
  "receipt_id": "govrcpt-sha256:06980ef596121a8166bbe7b9797afea2f3f06cbfdfc7762320f4aba2780b5340",
  "request_id": "req-rollback-edition",
  "schema_version": "country_outage_p2_s0a_governance_receipt_v1",
  "status": "applied"
}
